{
  "version": "1.0.0",
  "last_updated": "2025-11-21T14:30:00Z",
  
  "memory_semantic": {
    "entries": [
      {
        "id": "MEM_2025-11-15_AdaptiveCoupling",
        "content": "Multi-layer architectures require adaptive coupling for R4 stability.",
        "status": "confirmed",
        "evidence": ["Campaign_3", "TOY_MODEL_FINAL_v2-v3.1"],
        "project": "AGI_INT",
        "confidence": 0.95
      }
    ]
  },
  
  "sigma_state": {
    "projects": [
      {
        "id": "AGI_INT",
        "label": "AGI Intentionality",
        "coherence_score": 0.87,
        "open_questions": [
          "How does adaptive coupling scale to N>20 agents?"
        ]
      }
    ]
  }
}
